[
  {
    "camera_id": "cam-01",
    "enabled": true,
    "label": "Estantería principal",
    "source": {
      "host": "192.168.1.100",
      "port": 554,
      "username": "admin",
      "password": "changeme",
      "brand": "annke",
      "channel": "101",
      "path": "",
      "transport": "tcp",
      "fps": 20,
      "width": 1280,
      "height": 720
    },
    "output": {
      "protocol": "rtsp",
      "relay": {
        "enabled": false,
        "mode": "listen",
        "push_url": "",
        "listen_host": "0.0.0.0",
        "listen_port": 8554,
        "path_suffix": "cam-01",
        "username": "",
        "password": "",
        "iframe_interval_sec": 3.0,
        "force_transcode_gop": false
      },
      "webrtc": {
        "enabled": false,
        "mode": "whep",
        "signaling_url": "",
        "room_id": "",
        "stun_urls": ["stun:stun.l.google.com:19302"],
        "rewind_offset_sec": 3.0,
        "auto_connect_whip": false
      }
    },
    "buffer": {
      "duration_seconds": 180.0,
      "default_playback_offset_sec": 6.0,
      "event_pre_seconds": 6.0,
      "event_post_seconds": 24.0
    }
  }
]
